Comment,Sentiment_negative,Sentiment_neutral,Sentiment_positive
me encanta el trailer y el temazo que han elegido,False,True,False
klopp really being modern day mourinho,False,True,False
shluggishness to start the protest that could be a problem in our work environment as well lets try to be more in time for work and work with greater vigour to make this a nicer country to live in,True,False,False
you are the best professor i have this semester,False,False,True
158 just get a nail clipper,False,True,False
355 not really c is much more complex than c you have the standard template librarystl templates check stdenableif for example different methods of casting cstyle cast staticcast dynamiccast reinterpretcast rtti run time type information concepts and constraints some kind of traits concept and require keywords rangebased for loops rvalues and lvalues lambda expressions stdlaunder i dont know what memory laundering is and more using c with standard c functions is a antipattern same for using c as c with classes as it was initially created,False,True,False
rip to the toyota lancruiser also killed in the bombing it would have reach a retiring million km mark with proper motor oil transmission oil and gear cases maintenance it will be missed by the local dealership mechanic,True,False,False
one of the best thing about dude is that he never takes credit for himself when he achieves something he always respect us the audience and his team and he is always polite in all of his videos we congratulate ourselves on this achievement more to come and everything to come,False,False,True
wage slavery during the apocalypse polls poorly who would have guessed,True,False,False
good stuff,False,False,True
i love how this channel is like beluga but a cube version editthanks for 485 likes guys can we get to 545 likes,False,False,True
have you considered using the recoil of the magnet when you catch it to give you a little push maybe as a kind of directional double jump,False,True,False
firstly screening the literature is the most important aspect of a systematic review and for any other types sonot teaching students how to use ovid medline cochrane tec and only relying on pubmed is certainly the worst start up you miss such a large number of studies that whatever conclusion you try to draw will be biased and therefore unreliable,True,False,False
i cant imagine the world without chris hemsworth playing thor,False,True,False
the guy who shot the officers trying to arrest them is a total chad,True,False,False
no one chemist ill just throw acid on a gas vehicle,True,False,False
i thought everyone knew about the dinosaur one  that was me and my brothers childhood,False,True,False
thank you so mush for the advice i tried all of your hacks and they actually worked well anyways thank for the advice,False,False,True
lol government give corporations that are making record profits more money for canadians childcare is the fix for inflation give me a break governments are there to screw the small guy get another job step off,True,False,False
i swear the old people laughing with finger waves is one giant acid trip,True,False,False
i credit crash course with my success in bio105 when you cover 2 chapters a week and youre taking 15 credit hours4 classes total its pretty much hilariously impossible to actually grasp the material as you progress and really understand it,True,False,False
i feel happy when i receive a notification of subscriber,False,False,True
so people who paid their debt off just as people who immigrated to usa legally are slapped in the face by people who cannot or will not pay their debt,True,False,False
i have always used stickerless cubes from when i learned all through now one day a friend and i swapped cubes to see how our times got affected by using each other cubes i like my cubes fast he likes them slower his main was a stickered cube not only was i turning bad because the cube was slower then i was use to but the stickers felt so weird i just cant use stickered cubes because of the edge on the sticker,True,False,False
i now know i like this guy i at first thought i had some type of prejudicial dislike of him maybe because he was too smooth and that goes against my grain but i love this guy because he does seem to care about things and many of them seem not to be regarding how much money he can make off of a ad for a person it seems as his reviews are sincere and these seem not to have to do with what ive seen only from him which is technology i really love the fact that this guy cares about peoples safety and he brings up some safety issues which people should be concerned about if they have children especially with the toys and the baby monitors yeah this guy is getting a big a from me,False,False,True
in the aftermath of the recent asian financial crisis many blamed international institutions corruption governments and flawed macro and microeconomic policies not only for causing the crisis but also unnecessarily lengthening and deepening it at the turn of this century most economists in the developed world believed that major economic disasters were a thing of the past or at least relegated to volatile emerging markets financial systems in rich countries the thinking went were too sophisticated to simply collapse,True,False,False
the key to nailing an interview is to always remind yourself that people dont want the truth they want validation,True,False,False
terrific parimal bfsi is anyway ur forte so such a high quality insight is given,False,False,True
luke makes it legit funny not scary like i was actually laughing to death bro lol,False,False,True
the people that are making the threats need to be locked up,True,False,False
i miss the days when the history channel was actually the history channel,False,True,False
spent the first seven years of my career teaching florencia 13 gangbangers in huntington park ca they were middle schoolers and spent the better part of the day trying to keep their pants up but as tough as they wanted you to believe they were most of them were just babies trying to fit in then i moved to a high school and stayed in touch with two who went in different directions one is now a highway patrol officer the other was murdered by his cousin at the direction of a rival gang to this day i feel more affection than fear for these lost souls,True,False,False
yknow how many actors it takes to screw in a lightbulb one he holds onto the lightbulb and the world revolves around him danny devito national treasure,False,True,False
when are we as a nation going back to sincere governance elections are partisan by nature but governing is not supposed to be encumbants are tasked to address all the needs of all the citizenry the job of leadership should never be to retard the nations progress when their party doesnt hold the majority the lies and the one upmanship has got to stop the victory should be seen as the nations rather than just one party or the other it is the job of all who are serving to facilitate our progress we are so much better than what we have been doing we may have fallen short of our ideal but we should never stop striving we are guaranteed not to make it if we quit,True,False,False
two legends ,False,False,True
this man took the time to stack all those fries  respect,False,False,True
if this actually does end up getting trump reelected in the future i will laugh harder than i ever have,True,False,False
let me guess this is the bottom ajajaja george has been saying the same thing the past 1000 weeks ,False,True,False
im really excited for hogwarts legacy as that looks like it could be something both fantastic and fresh,False,False,True
they really just dont want him to rerun for presidencyhes not in the club,True,False,False
spent the first seven years of my career teaching florencia 13 gangbangers in huntington park ca they were middle schoolers and spent the better part of the day trying to keep their pants up but as tough as they wanted you to believe they were most of them were just babies trying to fit in then i moved to a high school and stayed in touch with two who went in different directions one is now a highway patrol officer the other was murdered by his cousin at the direction of a rival gang to this day i feel more affection than fear for these lost souls,True,False,False
thank god yall are okay quality content love it d,False,False,True
i answered 52 questions in 1 minute i got all of them wrong though,False,True,False
imagine this you wake up in a room that youve never seen before the bed youre lying in is very comfortable you sink right into it you dont want to leave but you want to know where you are you sit up and looking around the room you see that it looks like youre in a very cozy but very old room this room has seen many many things it seems theres a mirror to use in case the person staying in the room would like to fix themselves up to look nice there is a closet full of clothes however you see that there is already an outfit laid out for you if you prefer the feminine choice it is a beautiful seafoam green dress with a black and white striped bow and reaches just below your knees grouped with black mary janes and long white socks the masculine option is a suit that consists of the same colors in the most similar areas with black dress shoes you put on the outfit of choice and you leave the room you go down the stairs of the house to find two people they look like blonde twins one is a boy the other is a girl they are sipping their tea when one of them notices you oh youre awake the boy cries so they are the girl replies they introduce themselves as aaron and anastasia aaron tells you that since youve been asleep all morning it would be good for you to go outside with them you reluctantly agree but all of your worries fly out the door when you step outside you see a field that looks like it was masterfully painted a nice mix pastel colors by the gods themselves there are mountains in the distance and you can also see a nice pond in the sky you can see the moons and even a planet or two you can even faintly see the stars there are trees by the pond and one of them has a pair of swings the three of you walk up to that tree and you spend the rest of the day playing there the twins took turns pushing you on the swing eventually night came and you went back to the house for dinner anastasia made the most delicious bread and pasta youd ever had and aaron did the dishes insisting that you relax as their guest after a little while you retired to your bedroom changed into the clothes given to you and succumbed to a calm dreamers sleep wondering what the next day had in store for you,False,False,True
i swear the goob is a magnet for exposure to the grossest things on the internet,True,False,False
i want to go to pakistan just to eat food with ali i really enjoyed his personality hes got a great sense of humor and hes obviously super passionate about educating people on the beauty of his country,False,False,True
the spirit of the antichrist is always among us,False,True,False
honestly your pink sauce looks good can i buy a bottle,False,False,True
would have been nice to see what per student funding was per state as well see which states are getting a return for their dollar or correlation between and funding and results,False,True,False
superb sir i thoroughly enjoyed of learning machine learning your energy and practical way of teaching makes more eagerness towards learning data science,False,False,True
this band is never disappoints us lets go 1republic d,False,False,True
this is a once in a lifetime achievement one that he will probably never repeat there is no need for him to do it again we all know trying to achieve top marks is hard enough but when you are constantly pressured to do so it is definitely mentally taxing,False,True,False
this isnt the nintendo i grew up loving yeah because you werent paying attention back then easily your most cutting line to date,True,False,False
05072022 lecture 1 wellposed learning problem is said to learn from experience e with respect to some task t and some performance measure p if the performance on t as measured by p improves with experience e see not that complex,False,True,False
i think we all know why hank smiled when he said it cant penetrate and come into it,False,True,False
can we move to the fact that the girl with yellow hair looks like a minion,False,True,False
mujhe esa lag raha police se jayad aap ke dard ho rha he,False,True,False
the literature review has always been a pain in the head especially that we are now in a pandemic students such as i have problems in collecting the necessary number of sources thanks ms i enjoyed the video and thank you for being a big help to those who are struggling,False,False,True
you still have clapped british teeth,True,False,False
tldr 1 own something 2 try to make it a monopoly either legally or physically eg tie it your personality,False,True,False
as a lapsed superbike obsessive it always bothered me hearing gcn call top road bikes superbikes now i mostly watch cycling and im used to it,True,False,False
if you read barbara walters how civil wars start you would know that there are two issues that lead to violence anocracy and factionalization democracies dont fight nor do authoritarian states its the transition from one system to the other where the hazards are found thats anoncracy factions in the book means when people sort themselves by ethnic or sectarian attributes rather than policy preferences and this sorting creeps into their entire lives weve been on that course since the tea party started the only cure is doubling down on democratic participation the gop is pointedly not doing that anywhere theyve got their hands on the controls we are being steered right for the ditch so im glad at least one in five of us say thats the 1 problem we face,True,False,False
mom wake your ass up for classes me oh nah nah nah nah nah na theres a meeting in my bed,True,False,False
before it used be microsoft and now we see more and more on apple and for the obvious microsoft dominated desktops and now apple dominate mobile device end of the day it is all about consumer and these companies now need to do even a better job for the software development,False,False,True
excellent 1st session excited to do the 2nd part tomorrow i am trying to revise my ml knowledge to get back to competing in kaggle,False,False,True
klasa sama w sobie ,False,True,False
i wish that i had a video like this when i was at university seven years too late unfortunately but even so this video is still useful for learning computer science and programming through online courses like at the moment,False,False,True
every year during the month of june and august they is a reason for people to lose jobs these unions are getting paid for this disorder,True,False,False
hello mam im a firstyear engineering student and since class 11th i had an interest in mlai i already know python and math topics like linear algebra vectors matrices since they are already in my engineering as well jee course so can you please suggest some more skills that i need to learn,False,True,False
i had a tutor and a friend student that excelled in classes the tutor is doing well but my friend is now deceased beaten to death as a street person on drugs the tutor that helped me told me that the reason one goes to school is to learn to teach yourself if university does not teach you to teach yourself you have failed because if you cant teach yourself you can not teach others what you have learned i have this discipline in my agenda on full and have helped other students in the past,False,True,False
this man literally born to create history hats off to jimmy and the crew,False,False,True
the sat reading section was like torture to me i would get 20 questions wrong all the time but with alot of hard work and dedication i ended up getting a 690 on it you can do this guys,True,False,False
no one is above the law his wife says words have no conviction when its for your drunken husband,True,False,False
finally somebody with enough balls and cash to set up a proper fireworks for this boomer to enjoy thanks jimmy,False,True,False
to listen to ptr is so refreshing so enlightening his mastery over language facts and figures and marshalling of points and the articulate and down to earth manner in which he conveys them with out being rhetorical is amazing he is a rare intellectual politician or should i say a thorough bread financial professional that our country needs he calls a spade a spade he will go places india needs to tap his experience and expertise i salute him for what he is doing for the country,False,False,True
just for those who are new to chess the towers are rooks the horses are knights the diagonal ones are bishops then obviously the king and queen and pawns,False,True,False
those are valuable pieces of advice i always get caught going deep but my main problem is distraction i end up learning too many things,True,False,False
it cant penetrate and come into ithank,False,True,False
the reason triple aaa games are becoming so expensive and some are totally failing is just because they focus on tech and not on design theyre treating what were supposed to be enjoyable games as engine demos and not giving enough time to release them properly you cant just create another gta v every single year that shit takes a lot of time,True,False,False
can we just appreciate how much work jimmy and the boys put into their videos to make all the millions of us happy keep it up ,False,False,True
you mean putin didnt tell the truth im utterly shocked i mean noone saw that coming did they lol,True,False,False
the world is laughing at us as we slowly split our country apart these people have abused there power for too long now,True,False,False
hello sir can you guide as of how to apply in big companies with my experience ive been in staffing for 5 years now and started data science learning need your guidance sir,False,True,False
please react to devdas this movie has the best cinematography award and best actor and actress and director award and for best film and one of finest films ever made in india and the performance of the actors was on ,False,False,True
1 wrong move and its all gone,True,False,False
i did my undergrad in computer science and im finishing up my ms in computer engineering it always drives me nuts when people ask what i do and then assume either is just programming or software engineering i try to explain it like this computer science is centered around mathematicscomputational science and problem solving developing algorithms and optimization programming is just a means of applying mathematics and problem solving techniques to problems computer engineering is focused on the development and design of computer systems i always get a reaction to my code from the guys that took computerelectrical engineering as undergrads because they generally speaking are simply trying to make x thing work and i am trying to make x thing run as efficient as possible you can take several different paths to become a coder but theres very different mindsets developed across the different disciplines anyone looking at going to school for computer science should understand this you are learning to be a problem solver first coding is secondary anyone can learn to code but being a master problem solver is what will set you apart in life and your career if you go down this path you are going to be doing far more math than coding and at the end your undergrad you will realize you barely learned how to code you will have to spend countless hours after graduation learning coding concepts libraries and frameworks but those problem solving skills are what will allow you to put all of that to use i hope this helps someone understand what they are getting into,True,False,False
at least in my town we have 1 old zoning law that prevents thousands of affordable lots from being developed lift that restriction and ideally streamline permitting and loosen regulations but they wont too much local vested interest in keeping the supply down i know my town isnt the only one with this zoning law,True,False,False
damn this man is sharp for his age my granddad bless his soul only got to live to the age of 79 and in his last 3 years he deteriorated to such a degree that he couldnt function at all it was sad to witness sir penrose is 90 now almost 91 and he talks about stuff in a very clear way which most adults arent able to do amazing,True,False,False
so now mr beast is creating job opportunities by making people leave their jobs,True,False,False
incidentally i find that your video has the subtitle generating by cell phone automatically due to curiosity i check the consistency between the subtitles and annies speech and surprisingly i find that they are highly consistent its revealed that annie has crystal clear highly correct and very fluent speech quality thats awesome and i appreciate the way she teach,False,False,True
yako oita wada hodai mokuthma anayanaya nokara lankawe minissuth marenda erala pitaratin minssu anayanaya karanam,False,True,False
the way he factually states the world is a sphere makes you feel like hes heard even weirder statements before and this is just another misconception he corrects ,True,False,False
the builds they did look super cool they surely didnt use machines or something right,False,False,True
really relaxing ,False,False,True
whatever happened to the communicating a threat charge and now that its against the fbi you have to charge these people regardless if you feel if its meaningless or not when have the fbi been afraid to arrest people making death threats what has happened to our government,True,False,False
if the market is so heavily effected by a tweet then it isnt based in reality a home gallons of gas or milk etc are always in demand and you cant say the price doubled because of economics why do economy dynamics always favor the rich the prices never fall when the current crisis is over not significantly,True,False,False
thats so weird hes been screaming he wanted transparency the whole time and now he doesnt want anybody to look at the documents he stole,True,False,False
i miss the days were entertainment was entertaining,False,True,False
this to me is a reflection of our society it looks like we still have growing up to do usually if you have to think twice about it ask the internet theyll get you perspective ,False,True,False
this is literally an entire semester of a 400level evolutionary developmental biology course summed up in a 5 minute song fucking legendary,True,False,False
the reason why pennywise said fear when he was defeated is not because he will spread more of it its because he is feeling fear and he let go for 2 reasons so he can go down to his lair and because hes in shock,True,False,False
its hardly surprising even in rich districts teachers are underpaid undervalued and overworked they are expected to take on more responsibilities every year with fewer and fewer resources all while administrators ignore their pleas and parents treat them like overqualified babysitters my wife quit teaching several years ago she was working 67 days a week and spending hundreds of dollars a month on supplies just to keep her classroom running and the school gave her absolutely no support with unruly students,True,False,False
he repeats his stories alot and tbh i think thats what made him such a good explainer he hones the same explanation until he masters it and finally blesses us young minds,False,False,True
we are justifiably utterly sick and tired of the scammers spammers bots and every other type of grossly undesirable piles of festering human waste thats an epidemic on the dating sites as well as other social media sites,True,False,False
the quality of content this man brings us to entertain us is just huuuuuuge,False,True,False
this is a topnotch video about the typical english interview i wonder if they read a script or not but even if they had done it its very smoothly delivered and the connective speech between them was not a problem at all interestingly enough we can bump into the questions they used in my country korea in the last few months i joined several facetoface job interviews and they were not much different from one another very well done,False,False,True
to be clear that basketball player 217 did not intentionally bounce that basketball into the hoop he was trying to throw it at the opposing team in order for them to retain the ball by making the ball go out of bounds off i the other player,False,True,False
bring elder scroll online to cloud gaming,False,True,False
i just found your channel a few days ago and i have been obsessed i love seeing the crazy things you do and build,False,False,True
1010 so a fish can kill a bear but a bear cant kill a fish sounds reasonable,False,True,False
the fact that balan wonderworld and breath of the wild came out 4 years apart and both cost 60 makes me unbelievably sad,True,False,False
its unpredidented that a former president should be subjec to a search of his home yep and so was inciting an insurrection and failing to oversee a peaceful transfer of power hypocrits much,True,False,False
success is no accident it is hard work perseverance learning studying sacrifice and most of all love of what you are doing or learning to do,False,False,True
beautiful finally a new sonic game that does justice for the original series the first showcase was strange but this one is definitely better compared to the old one,False,False,True
shame,True,False,False
i had the same idea using a skulk sensor for a secret base entrance i used it at a mountain and put it at a spot where you can get to the door in time but the pistons dont activate it nice job with yours,False,True,False
