Comment,Sentiment_negative,Sentiment_neutral,Sentiment_positive
i wish they had more footage on deep blue there are only two videos of her that i know about that original one and the one where they saw her off the coast of hawaii just watching her swim around impresses me she is huge,False,False,True
000intro 037backpack 14016inch macbook prom1 max 223sd card reader 242airpods max 259airtags 307body cap for canon r5 313webcam 347canon r5 418cables 454power adapter10w 502realme power adapter 533apple watch charger 600pens 611adapter 640wallet 750iphone 13 pro 814pixel 6 pro bye,False,True,False
are they really that hard up for candidates in new york,False,True,False
i miss the good old days before mojang became extremely lazy and restrictive,True,False,False
heres another con cs is not an easy degree to get im currently a graduate student in computer science and i also teach freshman computer science courses im a teaching assistant so i teach labs professors give lectures and from what ive seen at least 40 of the freshmen entering computer science will be weeded out by the end of the year or as tren black would say business by christmas also very important contrary to what a lot of people think cs is not software engineering youre not just going to be writing code all the time youre going to have to study algorithms data structures formal methods discrete math computer architecture etc if you dont like math and youre not good at math you better buckle up and start reviewing or you too will be business by christmas,False,True,False
the sat reading section was like torture to me i would get 20 questions wrong all the time but with alot of hard work and dedication i ended up getting a 690 on it you can do this guys,True,False,False
i try reading ulysses every now and then to deflate my mr knowitall attitude the ultimate leash for my intellectual pride,False,True,False
toujours des bonn conseils merci,False,True,False
im leaving my comment here so when someone likes it i can listen to this masterpiece again,False,False,True
i request for the csv file for linear regression for practice,False,True,False
me learns en passant also me i think im ready to defeat magnus carlsen,False,True,False
ive been vaping on and off for 5 years having my honorary internet mom sound slightly disappointed in me made me throw everything out and i havent touched anything since this video came out its been rough but thank you for making me take the first step in getting healthier,False,True,False
unbelievable recently filmed in germany titled the innovators featuring 5 young adults from around the world who have turned their industries on their heads and impacted them forever opens with dimash qudaibergen at 28 is changing the face of todays music worldwide widely considered a music and business genius sole head and decision maker of his production company its state of the art on a campus of studios stage warehouses conference and creative centers and administration buildings and produces every aspect of his career in house from films videos albums to concerts tickets sales and distribution of merchandise pr marketing administration legal and more surrounds himself with world class talent in every field hands on and laser focused the only operation of its kind globally no air date yet,False,False,True
this song is so reassuring in a strange way its so comfortable to listen like a goodol friend youre happy is around,False,False,True
thanks man for clearing this up especially in india all it companies have made a mess about data jobswhy dont you make a video dscussing these jds especially from india these all are mncs,True,False,False
as stephen hawkins said once they open pandoras box she aint going back in ,False,True,False
you cannot forget super mario odyssey the music just gives me shivers,False,True,False
omg such awesome day to day life examples given for perfect understanding completely mesmerized ,False,False,True
ned stark would have never ever sent one of his daughters to do foolishness like that and it makes me miss him yet again,True,False,False
love the video but it brings back painful memories of being a 24 yr old young man with 360 waves putting dax pomade in my hair and now 36 and bald with a beard life comes at you fast ,True,False,False
omg as an international student i was kinda hopeless abt this exam before i found your channel bu damn your videos are lit and i feel better now ,False,False,True
i could not imagine that mother having to continue to fight for her life with her sons body nearby absolutely heartbreaking,True,False,False
can we now say lock him up,True,False,False
jesus christ can we wait until the 14 actually comes out ,True,False,False
it tells us that we are looking at the universe through the wrong end of the telescope,True,False,False
why does derrick have a pad on his forehead ,True,False,False
this child has been practicing his pick up lines for this one moment,False,True,False
i wish i wouldve looked for this video a lot sooner the sat is tomorrow for me,True,False,False
ive read that hydrogen can work its way through any container material in your piece about graphen it was stated that it is impermiable to gases even the lightest one assuming the narrator meant hydrogen it might be a solution to the long term storage of hydrogen perhaps,False,True,False
a grade school teacher i once had used to tell us repeatedly your sins will find you out trump must have skipped all those classes that would explain his reckless criminality on so many levels not to mention his basic stupidity as far as michael cohen is concerned theres a guy who not only uses his brain but demonstrates courage contrition humility and a renewed sense of civic pride in stark contrast to any trump behavior,True,False,False
when copypasting code its important to know what youre writing try to understand what each line does it helps troubleshooting and learning,False,True,False
this is what beluga would become if he was a speed cuber,False,True,False
im not a religious person but if the anti christ actually does exist then id rather fight on the side of good id rather die a good man rather than die an evil man good always defeats evil,False,True,False
i love how the lofi community is so chill and relaxedthis is literally the most peaceful part of youtube,False,False,True
i keep on getting med school ads on these bio videos and im like dude im just tryna pass grade 10 calm down,True,False,False
the true existential crisis comes when you realise he just described evolution in general we can recreate it we benefit from it yet we have no clue why or how its actually working beyond luck,True,False,False
awesome as always  no hype no moon talk just the charts and the facts perfect thanks jase ,False,False,True
nikkie should do a full korean makeup look,False,True,False
the story behind nagoro village from what i remember is that it was populated by mainly elderly people as all the younger residents left to find work in the bigger cities this artist was one of the residents and she would make the dolls in honor of the residents after they passed on so that they could live on in a way,False,True,False
my ex is a teacher and while we were together she was creating a multiplechoice practice test for her class before their gcses but the trick was that she designed the test so that every answer was c and laughed at the thought of her students panicking over getting option c for everything,False,True,False
this song is still fire after 4 years,False,False,True
i can tell you why trump filed it with this judge in particular he thinks every judge he appointed owes him for that and will overlook their oath to help him out if this judge says no he will call her a rino and appeal it with another judge as for why now he is hoping he can stall the investigation,True,False,False
school told us this was happening the week before the test i have roughly 9 hours until i take it cheers,False,False,True
the deadpool voiceover will never get old,False,False,True
very funny video ,False,False,True
shane you should interview people on your channel that work in these fields theres a pretty big community on youtube of data scientist you can talk to people in all type of careers honestly theres insight they can bring that you only get by working in the field,False,False,True
what im curious about is how did he manage to run a company in us while he was a student visa issue is a nightmare here,True,False,False
drop one thats half an hour long putther upload one where youre killing griefers in many ways from riding the train to using vehicles you dont normally use to trolling ,True,False,False
i appreciate the assumption that the guesser is going to be slighly off and not frantically looking for the number thats closest to whatever outlandish number they got to,False,True,False
lets not forget that apple pay in 2014 required a brand new iphone in order to use it a significant portion of apples user base wasnt able to use it even if they wanted to as each successive iphone incorporated the technology and older iphones were replaced the number of people who could use the technology increased,False,True,False
this was playing constantly on the television in my hospital room during spring 2021 in some commercial for the show the hills while i was in a coma so it has pretty much been seared into my brain i hum it constantly and always come back here to listen to it,False,False,True
too many rumors and with the recession coming i think its a wrong time to put stock in future guarantee apple and other big companies just dropped a big number of employees and its going to get worse if the recession is really coming,True,False,False
lannan sees the one he had to blur also him continues looking and scrolling,False,True,False
ants are truly insane did you know that wood ants even sacrifice their own lives to save their colony the territorial battles that break out between neighboring anthills each spring are warfare of the highest order involving thousands of casualties and chemical weapons our film team was thrilled when they watched two colonies how they conduct scouting expeditions and subdue their enemies,True,False,False
ive been studying with the traditional academia style from my chidhood and i think this was one of the reasons of my deep unhappiness everytime i had to go to the school and i agree the system can be totally useless when it comes to study died things in only books and not providing experiential oportunities to learn for children its a very serious matter that i hope will dramatically change very soon i adapted to the system and became succesful in the studies but i can tell not in life sharing my experience all the best to you guys,True,False,False
tride is the definition of work smarter not harder clearly that is why hes a youtuber,False,True,False
im supporting atozy all the way,False,False,True
we need this on spotify,False,False,True
this man needs a noble prize,False,True,False
that tactical one just hits home man like its crazy,False,True,False
me a canadian high school student the sats dont stand a chance now,True,False,False
shes speedcubing in another level by learning cfop so fast,False,False,True
its actually 3 cubes proceeds to make a whole new dimension,False,True,False
i cant wait for them to perform it on vmas im actually kinda expecting this dance practice video because literally earlier this day i checked their last comeback on how many days til they release their dance practice and its only 6 days so i expected it to be released today,False,False,True
the random canadian accent out of nowhere gets me every time ,True,False,False
one of the best thing about dude is that he never takes credit for himself when he achieves something he always respect us the audience and his team and he is polite in all his videos congratulation ourselves on this achievement more to,False,False,True
while working on my masters in education one faculty member told me that in his opinion our schools were designed to babysit our kids so the parents can work,False,True,False
i love monopoly this would be absolutely amazing,False,False,True
i would love to see lives and unedited content i would watch it ive been here since the beginning and ive been loving your growth you seem to be thriving in the new space and im here for whatever content you put out sending blessings to you and james and puka of course  im shopping this video while watching  rip no buy,False,False,True
the germans really did hand the soviets a beachhead fortress in this city with all the bombed rubble it only became more of a nightmare to advance into,True,False,False
finally somebody with enough balls and cash to set up a proper fireworks for this boomer to enjoy thanks jimmy,False,True,False
jays little wees at 615 gave me life,False,False,True
i agree with you it doesnt make sense for someone to go to a comedy show and be madin reality comedians are a stress reliever,True,False,False
legends know this trick when rubiks cube was invented,False,True,False
adam keepin a straight face while dan explaining the pros and cons of having 38 bitches around at all times had me dying,False,True,False
more over alex exposing us to a lead solder smell and grinding dust,True,False,False
my grandmother was born in 1944 she was the youngest of five children the village where she was born was located in communist controlled territory so the eamelas forces would regularly interrogate locals in case of any anticommunist activity her father decided it was best to stay neutral and simply cooperate with the communists then some guy in the village who had some dispute with him framed him for anticommunist activity the whole family my grandmother being just a few months old was transported to a prison camp set up by the eamelas for anyone accused of opposing them there they rounded up all the men and executed them my greatgrandfather was beheaded with an axe and his body was thrown into a well soon the prisoners were liberated and they returned to their homes my grandmother grew up without a father something which still deeply affects her to this day because of that she simply dismisses anything remotely leftwing because of all the trauma caused by eamelas the greek civil war is one of the darkest pages in greek history and you can still see how it has divided us,False,True,False
0339 tell me about yourself 0435 why is there a gap in your resume 0549 what motivates you 0648 why are you applying for this position 0748 walk us through your resume 0855 why do you want to work here 0932 why are you the best person for the job 1025 where do you see in 5 years 1055 what interests you about this position 1201 why are you a good fit for this position 1316 tell me how you dealt with a tough challenge 1428 why should we hire you 1611 what are your weaknesses 1716 tell me a time when you went above and beyond the job 1840 tell me a time when you reached a goal 1912 why did you leave your last job 2035 what are your strengths 2144 what are you most proud of 2305 describe your current job 2343 what is your management style 2518 tell me about a mistake you made 2627 what are you passionate about 2755 what do you know about our company 2925 how did you hear about this job 3043 what are your salary requirements 3240 how do you deal with pressure 3358 are you open to relocating 3552 what is your ideal dream job 3730 why are you changing careers 3947 do you have any questions for me 4140 how long does your hiring process take 4225 what is key to succeeding in this role,False,True,False
when some random people are able to teach this kid better morals than his actual parents,False,True,False
working in the restaurant industry i cannot believe how many people think simply owning a restaurant means you sit back and let the money roll in,True,False,False
that pretty much solves my problem gonna buy the latest 13 pro the green color is gorgeous,False,False,True
while i generally agree with your comments about ronin the callous disregard of collateral damage shooting into crowds and causing violent vehicle accidents was a total turnoff for me they spread injury and death among innocent bystanders without any sign of care or compassion,True,False,False
we also need to teach students how to learn einstein himself said i do t teach my students i give my students an optimal environment for learning and they learn by themselves paraphrased sure yes quality teaching is ver fundamental but without teaching them how to learn they would be dependent on other people rather than independent,False,True,False
kudos to people like you who make videos like this to inform people of what theyre missing,False,False,True
why would they not use limit trades should be common sense for any stock trader skews their data using market trades only,False,True,False
as someone with the correct clearance i can vouch just like so many of you that this guy didnt keep them in a place that meets requirements for storage of such materials also lying about all this is quick dismissal from your clearance ive seen people fail to get adjudicated for omission of one piece of information they thought wasnt important one lost it for keeping in touch with their mother who is from china their contact with their mother caused them to lose their tssci think about that and this guy and his followers think he did nothing wrong the level of failures here by the former president shows he is illequipped to handle said documents now its just one excuse after another day to day with the people who live in the real world of clearance all know that if we did 1 of what he did we be effed time to put your values you claim into action republicans dont claim it only when its convenient,True,False,False
what a gorgeous look thank you for always giving us tips btw i saw another youtuber who compared the amount of the ct bronzer to other bronzers in her collection and the ct had a lot less product in comparison i guess the packaging is deceiving not talking about the how good the product is just talking about the amount,False,False,True
with so many pot smokers now they should let the people in prison on weed related charges out,True,False,False
askgcntech riding in a strong crosswind the other day i wondered if a high cadence would give a gyroscope effect and reduce buffeting from the wind presumably from feet and shoes if so can ollie show us the maths please,False,True,False
 all things summer,False,True,False
i love how in the lofiverse every lofi maker doesnt compete they all chill together and promote eachother peace if only the real world was like this,False,False,True
that looks so delicious have a wonderful day,False,False,True
i need him as my teacher he looks like hes enjoying this and not doing it just for money,False,False,True
anak angsa lucu sekali  hewandunia,False,True,False
shes the type of person who puts a makeup on her forehead to make up her mind,True,False,False
how do i get in touch with google if i am locked out of my email and the recovery page cant help me,True,False,False
the british kid is amazing oh no i tickled his little nerve endings killed me,False,False,True
its almost like ancient cultures were made up of actual people who in many cases knew exactly what they were doing even if they didnt understand the mechanics behind it,False,True,False
the forest app is a phone based timer app basically you set a timer for however long you want to be focused for at the beginning it will plant a virtual tree in the app if you leave the forest app at all it will kill your tree,False,True,False
personally im stoked for the family plan,False,False,True
why would they be angry they voted for it,True,False,False
one thing about the inhabitated lodge given its a desert animal i think it would make more sense if its tadpoles inhabit its back a protected reservoir seems tl be good for tadpoles in a water poor enviroment and given how beecomb frogs already carry their eggstadpoles in chambers of there belly this would feel like a nice nod to this real animal in addition this could be a way to get mammalian or placentalian amphibians of sorts if it would continue to evolve along this line,False,False,True
i love this adventure steve,False,False,True
i love this yeeeessssss this song and music video just made me feel so good john legend and saweetie collab dope we need more music like this especially what is going on in this world today,False,False,True
amazing nature and wildlife on earth,False,False,True
these are actual adults who never grew beyond juvenile delinquency,True,False,False
everyone have a bless day and keep grinding  this is hard ,False,False,True
still very disappointing that the mini has been deleted from the roster there are still many users who prefer the smaller phone maybe in the future apple will once again offer the smaller phone,False,True,False
babe quick milkmansteve just uploaded,False,True,False
this reminds me of nezhmetdinovs bishop pair against chernikov,False,True,False
dop l love this song,False,False,True
phone are no longer compared by speed but by their features and use cases many mobile apps wont port and develop an app if no one uses them look at instagram they still dont have an ipad version if he proposes a plan that entises both potential customers and developers then it should work i highly doubt hell venture to the mobile market and build another os from the ground up both apple and android has a massive library,False,True,False
respekte nga cunat e shqiperis  big donxhoni,False,True,False
hey forrestknight what would be the best way to explain to a 6 year old the concept of classes and objects,False,True,False
chill drive  lofi hip hop radio lofi music to relaxstudy to,False,True,False
this would be substantially more terrifying if the bots werent drawn to be so cute,True,False,False
all president trump had to do was give the fbijustice department all of those documents that they wanted the first time that he got a subpoena and there wouldnt be all of this drama right now once again he creates problems and then blames others when they have to clean up his mess,True,False,False
kukul kama mila adukaranna appo munta posathwenna paribogikayo munge biththare kanna kiyana kiyana ganata masa34k warjane karama biththare welenawa hellenawa athakota kohomada vikunanne kikiliyonta wada bithara danne mafiya karayone,False,True,False
thats really a problem with service economy most tech companies dont even produce a nail they do things that are intangible you cay easily live without them if netflix goes down i am sure there will not be any catastrophic event if some manufacturing companies goes down lets say the one that makes baby formula it could trigger a panic,True,False,False
praying for those miners,False,True,False
woohoo  welcome on board kelly bout time,False,False,True
merrick garland is really the one us citizenpublic servant who is under more pressure than any of his country men or women up to and including the us president at this moment may he remain resolute,False,True,False
anyone else trying to cram 5 weeks of content the night before the exam,False,True,False
i actually have a mousemat that came with my desk thats larger than the one you have its specifically designed to cover the entire surface of the 55 inch desk since its a desk built for gaming,False,False,True
who elses sleep schedule got ruined my history bls ,True,False,False
his fbi agent boppin to his search history,False,True,False
i estimate this most definitely took over a month to make editing on point humor on point good shit,False,True,False
lets not forget that apple pay in 2014 required a brand new iphone in order to use it a significant portion of apples user base wasnt able to use it even if they wanted to as each successive iphone incorporated the technology and older iphones were replaced the number of people who could use the technology increased,False,True,False
that was soo helpful thank you soo much and i never knew this syndrome was a thing but just you talking about it made me fear the major so much more knowing that ive gone through this so much during school and college feeling like the dumbest one in class ill take your advice and thanks for letting me know im not alone,False,False,True
ive waited for so long to see you guys troll people with a tow truck lol,True,False,False
kpop raps ballad country music or any kind of music or song nothing can beat lofi it takes me to a different dimensions where i am the main character it takes me to a place ive never been with but the feeling feels home ,False,False,True
declawing cats stop calling it declawing it has nothing to do with the claws as the vet said it is amputating the toes cats have claws if you have a problem with claws dont get a cat,True,False,False
local sight is a common mistake at least for me at fast time controls you focus your attention on a specific area of the board and just forget that far beyond a long range piece is defending a square you judge unprotected,True,False,False
i really dig the origin they gave him in the 2008 film because the military gave him something before he went powerhungry and took the risk of adding hulks blood to the mix that way the abomination thing actually makes more sense,False,False,True
912 for scarlet and violet coverage,False,True,False
why does derrick have a pad on his forehead ,True,False,False
puri sirsuper sukku sirsuper,False,True,False
its heartbreaking how sad strange is when he says everyone who knows and loves you we we will have no memory of you,True,False,False
humans i feel afraid ai i feel like im falling forward into an unknown future that holds great danger,True,False,False
