Comment,Sentiment_negative,Sentiment_neutral,Sentiment_positive
great discussion thank you yuval said early in his talk that we should look to our governments to ensure that the youth of today receive the kind of education they need to survive in the future i would suggest that national politicians are likely to be the future useless people my government in africa has done nothing to help the people all it has done is line the pockets of the politicians education is already being reengineered today by the private sector udacity coursera come to mind there are huge changes taking place through these and other similar organisations and their association with universities around the world so the future of the youth of today depends on them thomas friedman in his book thank you for being late suggests that the previous digital divide between the educated and the lesser educated has gone and the new divide is the motivational divide the youth of today need to be intrinsically motivated and overcome the natural laziness that yuval tells us about and learn and keep learning what they need to know is what to learn then learn it with the help of the internet organisations like udacity khan academy coursera and coaches and mentors teachers in the world of yesterday schools also need to embrace these changes,False,True,False
great video as a beginner programmer i agree with most things you say one unspoken rule of programming is to google everything you dont understand its simply the only way one learns,False,False,True
those slick apple product videos havent been the same without jony saying alyoumineeum,False,True,False
more over alex exposing us to a lead solder smell and grinding dust,True,False,False
bounce is funny and duggy ,False,False,True
rani laxmi bai was a queen who faught brits after her husband died watch kanganas movie manikarnika it has the glimpses of rani laxmi bais life,False,True,False
nice tutorial kindly upload more related to implementation demo of supervised and unsupervised learning,False,False,True
people are dying out of hunger but some are spending money on things that dont exist we have truly reached the point of no return,True,False,False
niceee ,False,False,True
linus this is not a table also linus lets use this as a chair,False,True,False
who has a more annoying voice lucas or omrilol,True,False,False
zach smiles so happily while eating those delicious meals because he know the ones watching his video are dying of hunger,False,False,True
i want more videos on this please,False,False,True
what type of universities can i get into with a 1310 sat score and 36 gpa keeping in mind my extracurriculars sops lors etc are pretty average,False,True,False
if im thinking correctly ever since they opened the backrooms random holes have been appearing around the world this kid and the car driver happend to stumble upon them,False,True,False
this is so underatted wish it was more popular like if you agree,False,False,True
i rather him face off against mephisto then mourlen again or how about a mourlen powered up by mephisto anything to end the omd plague on spiderman,False,True,False
keeping 45 from engaging in his main grift of collecting funds to finance his electioneering would seem to be the major benefit to the public in the moment,False,True,False
also for all you wouldbe explainers 2 works for perfectly symmetric objects in a vacuum,False,True,False
912 for scarlet and violet coverage,False,True,False
interesting fact chaturanga in indonesia becomes catur which also mean 4 i believe it was adopted from sanskrit word check is called sekak which usually fit in to javanese language,False,True,False
this is so hilarious imagine if olor throws the 17x17 to the gan 330,False,False,True
this episode is ridiculously wellwritten,False,False,True
i defer to geologist geology is a true science archeology not so much nobody can explain how they were quarried transported and built the fact that egyptologists not scientists btw stick their story of when they were built is outrageous,True,False,False
i read an article about how there was an issue with police departments getting so attached to their bomb disposal robots that they didnt want to send them into danger the human urge to anthropomorphize is so strong that im not sure we are capable of discerning the difference between a clever language algorithm and sentience,True,False,False
the way she just said okay after you told her no promoting,True,False,False
data nerds what skill are you currently working on that is a nontechnical skill ie soft skill analytical skill domain knowledge,False,True,False
mr beast has gone so far and deserves every last bit of it youre incredibly generous and an amazing person keep it up,False,False,True
that cable organiser would be incredible in my dorm room,False,False,True
you can tell how close she must be to her mum she mentions her every 2 minutes its so adorable,False,False,True
i grew up in the shadow of cahokia and it has been extremely influential in my appreciation and reverence for all peoples in college we excavated a game processing camp many miles from cahokia and the enormity of the resources needed to feed their rapidly expanding population was an incredible story all on its own i appreciate how thoughtful and well made this documentary is and hope more will be coming in the near future,False,False,True
i just love the fact that even when some people lose they dont return home emptyhanded so they dont feel disappointed,False,False,True
this new editing style makes me feel so emotional not in a bad way just every single time i watch them i feel so many good emotions love this new style emma and from the looks of the comments everyone else is enjoying it too you are truly an artist,False,False,True
my father who passed away in august 28th 2021 taught me to do chores at home laundry dishwashing cooking house cleaning taking care of my younger brothers now my wife is so happy she married me because i do our own chores without complaining thanks pops miss you,False,False,True
ive always wondered how yahoo finance got ryan gosling as a reporter,False,True,False
new odia cover song asijaichi jaldi jaldi link open kariki apana mananka bhala paiba diantu,False,True,False
at this point i think that the whole point of labs was to fill it with more employees so that we never run out of intel tech upgrades i will buy as many screwdrivers as it takes to pay their salaries plz just give me more intel extreme tech upgrades,False,True,False
116 my favorite course from mario kart ds cant wait to race on it this thursday ,False,False,True
its a bit expensive and i didnt want to buy it as i have the original but my husband bought it for me as an early christmas present and i was able to transfer and re download my stuff overall im really happy with the oled version it feels more sturdy and the graphics are much better i was able to sell my original switch so we got quite a bit of our money back so i say its definitely worth it ,False,False,True
when marvel doesnt know their own continuity shathra who appeared in jms run never defeated peter she was close but as always peter persevered but morlun defeated spidey once the other 3 times peter defeated morlun the other villains who have defeated spidey are doc ock norman and kraven,False,True,False
if you hold c you can move props around without moving your character youll look like youre standing perfectly still,False,False,True
i love your nightcores,False,False,True
appreciate that they went for funny and wacky situations to put a hulk in rather than pushing the message that shes a strong female character gives me slight amounts of hope,False,False,True
do you want a sequel leave a like subscribe full length watch alongs more for sexy rejects,False,True,False
this laptop has the 4core8thread i5 11300h not the 6core12thread 11400h big difference and you need to update your video description accordingly also when you took it out of the box the battery was not dead lenovo laptops will not power on for the first time unless the charger is plugged in,False,True,False
i have encountered bears while hiking in alaska photographed the  in my pic but the mountain lion clips actually freaked me out the most,True,False,False
this music is amazing,False,False,True
n3on no way bro x2 me makes swish and breaks my brothers ankles n3on cant even dribble,True,False,False
series s game pass is the most fun ive had with gaming in many years,False,False,True
the fact that the windows get darker progressively is a sign of how attentive to detail latte is amazing work,False,False,True
big corporate management interview coming up tomorrow and this was so helpful as someone who has a bit of mileage i had an idea of the direction i wanted to go but this really solidified and guided me this was amazing and so are you thank you thank you ,False,False,True
my god these were the people that got trump elected in 2016 maybe a requirement to vote shouldnt be your age but your iq,True,False,False
we need more hodgetwins try not to laughs,False,True,False
i am new to the stock market every stock that i bought so far i was out of luck because i bought them when they were expensive i feel i missed out on all the stock opportunities so far for the tech stocksi believe having 75k yearly income would be a good investment so i want to plug all my savings into the stock market i know this sounds a bit dull but i would like to know if i should learn investing or let somebody else more capable like a fa do it for me please share your thoughts i am kind of tired of searching for a good stock to buy and losing all the good opportunities,True,False,False
you know a canadian made this list when a damn curling highlight makes the cut,True,False,False
as someone who has dreamed about building their own legitimate fireworks display this just makes me sad that i cant do what youre doing i put on a show for my friends every year but we just dont have the resources you all do love it regardless though,True,False,False
this dude makes it look easy respect,False,False,True
the same goes for all the careers and fields there are always pros and cons a riskfree life is the most dull and boring life,True,False,False
i just started and i am a freshman it makes me feel a lot better to know that someone else didnt have their resume ready i started html css and js on my own and am doing to websiteresume thing now so i can practice web development all through out college along with other stuff that i learn so i can put all of my projects on there kind of like a show case,False,False,True
im getting better but analyzing whos better but converting that advantage of pieces or space into a win is still a big challenge,False,False,True
i love how ethan just gets shit on at his own highlights channel,True,False,False
zach hample eating it is classic hahahaha,False,False,True
this to me is a reflection of our society it looks like we still have growing up to do usually if you have to think twice about it ask the internet theyll get you perspective ,False,True,False
this channel always has my favorite songs i love it sm,False,False,True
cosatu is trying to manipulate the people of south africacyril said before the prices rosehe said he discussed that with stake holders and labour unionswhy cosatu and saftu are marching now does this means they are not satisfied with the cost of living or they want to see how many south africans reacts,True,False,False
those are valuable pieces of advice i always get caught going deep but my main problem is distraction i end up learning too many things,True,False,False
i forget the trick and now i am solving for 1000000 years,False,True,False
my daughter graduated last night they played this song loud as the graduates left the field never imagined one direction would make me cry ,False,False,True
funny how democrats always choose the old white man lol,True,False,False
love how hayes reviewed swtor saw the terrible tutorial then made a whole video breaking down an effective tutorial,False,False,True
the dislikes are the teachers who just got outclassed,True,False,False
interesting interview its incredible how discussion turn more and more intense and how roger gave his answers,False,False,True
what i find good about stickerless is that you can be almost 100 sure that if youre buying a stickerless cube it will turn at least halfdecent while on stickered you may run into unfilleted cubes that require wrist rotations like the original rubiks series of course you always look closely at what youre buying but it just seems like an interesting little detail to think about,False,False,True
one of the best thing about dude is that he never takes credit for himself when he achieves something he always respect us the audience and his team and he is always polite in all of his videos we congratulate ourselves on this achievement more to come and everything to come,False,False,True
343 well its actually smart to carry around doors in case you want to mine underwater and you dont have respiration and aqua affinity on your helmet,False,True,False
the price of groceries has doubledrents have skyrocketed everything has increased except income ,True,False,False
do you have more questions about figma leave them in the comments below  and if you want to become a ux designer but dont know how to get started check out our video on that topic ,False,True,False
2022  escuchando estas fabulosas  diosas  una joya total ,False,False,True
the food today is so good i love ssoyoung,False,False,True
jaesa tum bol rahe ho ayesa hi himmat bjp ke liya dikha do,False,True,False
dude bold of him to say he now suffers from emotional distress when he himself caused you to vomit out of stress this whole ordeal must be a nightmare my heat goes out to you buddy and i wish you the best of luck,True,False,False
successful people dont become that way overnight what most people see at a glancewealth a great career purposeis the result of hard work and hustle over time i pray that anyone who reads this will be successful in life,False,False,True
thank you for being so simple kind and patient when explaining it really makes a change to have a good professor,False,False,True
deleted all the thumbs down,True,False,False
i can hear the we want ratcliffe chant as a united fan a selfmade working class roots billionaire who lived 8 miles from old trafford supporting united being a united owner you couldnt write the script its unbelievable,True,False,False
didnt obama say never underestimate joes ability to well you know the thing,False,True,False
i love blues what a beautiful music it echoes every where inside my mind,False,False,True
im surprised td ameritrade was 1 fidelity gives the best execution in my experience for nonoption trades and free trades interactive brokers provides fast order execution but you have to pay fees if you are a trader robinhood is by far the worst excessive pof others use pof but not to the extreme of robinhood,True,False,False
as an indian it was heart wrenching to watch what happened to the native american tribes of america my heart goes out to the survivors,True,False,False
i have my 3rd interview with a company in 15 minutes and here i am taking notes i have watched your other videos and im confident they are part of the reason why im being considered for this edit got the job bless this woman and her wonderful channel,False,False,True
legalize it tax it and pay for usa healthcare with it,False,True,False
i knew already some youtubers i used to watch had them on,False,True,False
this playlist helped a lot while i was studying thanks for doing this you are amazing,False,False,True
the little girl blew her cover so early in her career,True,False,False
the case was brought to federal court only to have another year of freedom his side clearly had no proper counter arguments from the start pity the court of having to deal with this drama,True,False,False
quem esta lendo esse comentario que deus de abecoe e ilumine o seu dia ,False,False,True
im surprised quantumania doesnt have a single set here may be something that comes later due to the bump up but no doubt morbius is the standout,False,True,False
stockfish crushes itself then analyzes its mistakes what a gigachad,True,False,False
they are alive in our hearts ,False,False,True
i think she should run for president as a democrat,False,True,False
the original infamous hurt my soul i played through the campaign twice on hard to get the platinum only to find out while i was doing cleanup that the stunt master trophy cant be completed post game i had all but one stunt to knock 3 enemies off a roof at once when you clear out an area enemies no longer spawn in large numbers therefore there isnt enough enemies to get the stunt i didnt have it in me to start another campaign the sad part is i had tried the stunt on multiple occasions only for it to glitch and not award the stunt,True,False,False
the music came before the movie christopher nolan gave hans zimmer a letter and asked him to compose something inspired by it check out the full story and dive deeper into this lesson on our blog,False,True,False
wow i loved this cant wait for the next one,False,False,True
gud pm po ang mandaue city at cebu city ay totally different cities po both belong to cebu province,False,True,False
after having a whole pandemic between the ending of got and the beginning of hotd its really wonderful to the see the bar crew having a great time all together in one place,False,False,True
not even 300 frames per second can save the plot,True,False,False
craftee can you make new videos like everything you touch turns to rainbows,False,False,True
that fort could also double as a panic room in case of an intruder,False,True,False
eggs were the last form of inexpensive protein available at the grocery government incompetence and indifference is literally taking food off your familys table at this point,True,False,False
pretty sure that daemon didnt actually say the heir for a day even in the books its implied that otto might have made it up to drive a wedge between the brothers and daemon just didnt want to say anything at that moment he is vile but he has his brothers best intentions in mind for sure,True,False,False
he lost me at it makes us look like extremist democrats why the hell can these people not respond to a direct question about their behavior without trying to deflect to democratsi agree with ms claire what is he talking about if a democrat was doing what trump was doing what would he say and do take some bloody responsibility,True,False,False
what was your biggest takeaway from my video comment below for weekly success tips exclusive content and behind the scenes of my life join my membership here,False,True,False
sped up songs been hittin different lately ,False,True,False
you know philosophers are very very patent peoplethey can argue for thousands of years about some ethical dilemma without resolution,False,True,False
i love how the first thing this guy says is a study regime and here i am 2 days before the sat having studied for maybe like 20 minutes watching this shit,True,False,False
this corona quarantine has me literally watching anything youtube recommends,False,True,False
pixel 7 or pixel 7 pro,False,True,False
the hypocrisy is out of control thanks jake for exposing these hypocritical people we need more of this,True,False,False
all those classified documents have been compromised may as well tell the about the damage and start looking for the copies he was planning to blackmail local government and foreign,True,False,False
adam kills me when he puts all of his great journalistic interviewing skills into people outside of his sphere yet back at the no jumper office he just talks in circles about nonsense ,True,False,False
ive been so anxious lately for 2022 and you have helped me to ease up a little and relax for once so thank you so much,False,False,True
when money plays out those millionaires have many ways to evade prosecution but when poor people get in trouble they are doomed,True,False,False
adenosine triphosphate shoots off third phosphate group adenosine die phosphate,True,False,False
i am just getting started on machine learning and this roadmap is a muchneeded one thanks for creating this much appreciated,False,False,True
im not a religious person but if the anti christ actually does exist then id rather fight on the side of good id rather die a good man rather than die an evil man good always defeats evil,False,True,False
i am 82 years old retired obviously i started work as a computer operator in 1968 and then moved on to cobol programming those were the days quite often we would punch our own programs into 80 column punch cards because the girls were busy doing the more important production work im really enjoying this python tutorial course of yours and so far finding it quite straightforward with no probs im just doing it for fun,False,False,True
25 years old and well versed in physics this was engaging to me even though i already knew the info and that shows how well this man teaches future bookmark for home schooling my kids,False,False,True
id love a everything is wrong version of this with us the viewers being the only ones on the flight and were in a rusty old plane that could drop at any given point perhaps daisy could be the flight attendant,False,False,True
the sound effects gets me dead more than the meme itself ,True,False,False
jimmy is one of the best man i have ever known in my whole life,False,False,True
jimmy we are going to be surviving 24 hours in a desert also jimmy we brang a genarator to charge our drone,False,True,False
it hugs my disturbed mind like an old friend truly peacefully ,False,False,True
my goodness it took me literally 6 months to get past the second layer and get to the speed im at todaycongrats ryden,False,False,True
this would be a great introduction for a crash course electronics series i really think you guys do a great job explaining complicated things simply,False,False,True
can i just say that n3on is a savage rn,True,False,False
basically a computer is just a grid of switches composed of carefully organized sand,False,True,False
dominos india have deteriorated a lot over the years their cheese burst doesnt burst anymore stuffed garlic bread doesnt have cheese in it and most importantly they dont use cheese anymore its all vegoil based cheese substitute even their customer care and store staffs are not as good as before i used to love dominos before but now its a nightmare,True,False,False
this whole comment section grew up with messyourself as such a huge part of our childhood i remember just watching lucious videos over and over and the granny videos its kinda sad to see you havent made content but everyone needs a break just know we miss you messyourself,True,False,False
c i g a r e t t e s,False,True,False
the way how the rich kid kept closing his eyes and making extpresions will making threats just made me cringe ,True,False,False
 free 6 step guide to choose your dream career,False,True,False
when i first got into watching netflix there were a lot of low budget but very original and interesting documentaries and tv series on it however in recent times i feel like a lot of the diversity in the platform has gone,False,False,True
vidhayak na name sahi se lijiye patrakar jiii,False,True,False
i miss you sridevi ji ,False,True,False
shame,True,False,False
the sat reading section was like torture to me i would get 20 questions wrong all the time but with alot of hard work and dedication i ended up getting a 690 on it you can do this guys,True,False,False
id never make my own mozzarella too much responsibility desi is a level 3 human being,True,False,False
i really was expecting a really messed up ending where the wife actually never loved him or something like that didnt expect it to be a wholesome ending great stuff ,True,False,False
lets all appreciate the content his man and his crew makes its just a masterpiece imagin whats hes gonna doing in the future,False,False,True
from bollywood these two actors can do these role ,False,False,True
the version we did as kids where i live was honestly a bit weird the direct translation would be three knives to the back blood runs down spiders crawling in your hair snakes round your neck crack an egg on your head and the yolk runs down and then youd usually say boo or something maybe lightly push the person as youre saying it too so yea pretty hardcore for a bunch of 6 year olds lol,True,False,False
epic so did you take apart each piece and combine the same colored pieces and then put together the cube,False,True,False
we have s400 and other top class defense systems so our country is safe from missile attacks from all sides tuimlog apni fikar karo,False,True,False
i am a computer science major and currently i am learning assembly language my professor is pretty terrible he doesnt really explain anything he just skims over power point slides but these crash course videos have helped me so much and made me understand how the cpu ram and the computer works in general and about the interactions between different components i am really thankful for these videos they also help me understand how my code is interpreted line by line and executed by the computer the relationship between software and hardware is just really beautiful the humans who came up with the computer and improved upon it are really some next level geniuses,False,False,True
things to respect the length of a blade the height of everything the weight of everything the ability to foresee the future,False,True,False
wtf ak47,True,False,False
