Comment,Sentiment_negative,Sentiment_neutral,Sentiment_positive
thank god that someone was observant and took action to prevent another mass shooting,False,True,False
i have had a love hate relationship with console exclusives i get why they exist and why they draw consumers to a specific platform this coming phil along xboxs track record concerning their exclusives since around 2013 and up havent exactly been praised as playstations have been this is more corporate weasel words xbox has cannibalized and quite frankly wore out their once golden franchises halo gears of war umim sure im forgetting some others the line is going to get blurry with where titles between the respective console manufactures games end up for consumption xbox has doing really well with game pass but they are missing that killer app for the system,True,False,False
waiting for review,False,False,True
my guy made a hollywood movie intro,False,True,False
i am obsessed with this song makes me want to dance my ass off i see im not alone its pure magic loves ,False,False,True
he does everything he accuses his opponents of doing publicly on video openly and his supporters say it doesnt happen you cant argue or debate that you can only ignore stupidity at the level of the average republican citizen at least as far as deciding who to charge,True,False,False
this is terrifying a couple days ago i was just talking to my friend who went to a music festival where the security didnt even check bags she was kinda scared how an event like that could easily be the target of mass shooting,True,False,False
now to get ready for gamescom,False,False,True
you know what is sad when you cant trust to even update your phone cause how bad the corruption is,True,False,False
love you guys so much  please keep up the good work,False,False,True
mrbeast is another world in this world,False,True,False
cannot communicate with sociopaths on any reasonable level people who cannot empathize will never see things from your point of view someone who is a sociopathic master manipulator can only be dealt with by affecting what matters most to them money unfortunately office sociopaths who gaslight daily rarely get reprimanded they have everyone else in the office convinced they are wonderful and that you are the problem best solution is to remove yourself from that environment,True,False,False
he didnt believe he was doing anything wrong by refusing to turn over these documents who in their right mind would want such a weak minded person that refuses to listen to advisors as president,True,False,False
successful people dont become that way overnight what most people see at a glancewealth a great career purposeis the result of hard work and hustle over time i pray that anyone who reads this will be successful in life,False,False,True
my friends were there last night fucking props to those that called it in,True,False,False
part of the problem is millions sold their homes to large companies like black rock instead of to actual families those type of companies want money so they jack up the rent and never sell those homes to families i know everyone want money but think twice about selling your home to those companies every time you do you prevent other families from being able to afford a home and subject them to outrageous rent prices i speak from experience,True,False,False
only in splatoon games they keep making the foreheads bigger,False,True,False
i have a hugehuge ratphobiaso i know i dont wanna encounter an albino rat the size of a small fully grown dogthe sight alone will most probably kill me,True,False,False
cool little detail you might have missed is that at the beginning when that guy finds the spear of destiny and then turns and looks over his shoulder at seemingly nothing it was because he sensed constatine was behind him later on in the movie when constatine uses that electric chair to track down where the spear is it shows him standing behind the guy when he finds the spear so its like a little time travel thing,False,True,False
i hope everyone here gets done what they needed to get done while listening to this we got this at the end it will all be worth it 3,False,False,True
him calls a gan cube a regular cube me wait thats illegal,True,False,False
dude thinks wage increases are the cause of inflation when it has been massively under inflation and people are being payed less value year after year since the 70s they mass printed haulted production and services filled their balance sheets and took on massive amounts of debt wage increases are a result of dilution not the cause,True,False,False
good luck to everyone who is taking sats on october 2 lets get iiiiiiit 1500,False,False,True
the market has been pretty bad until today it decided to surge everybody was practically crying then it kept dipping thats what you get when you feel you can navigate the process on your own big thank to mrs josphine leela im not bothered with how bad the market is because my assests are insured due to her advice and i still receive my profits,False,True,False
i still remember seeing mugsy bogues nail a morethan half court gamewinning shot at the buzzer in the early 90s also for the hornets,False,True,False
freaked my mother out but i remember read the iliad when i was in jr high not a class assignment just on my own talk about touching on every human emotion act etc that then led me to read the odyssey,False,True,False
this might be the best episode of this series ever so many great ideas,False,False,True
my physics teacher last year made every answer on our test c,False,True,False
the video we have been waiting on from tina ,False,False,True
the fire suppression without water was incredible it could save many lives and property especially if it could be auto activated like a heat detector imagine how much property and how many sleeping people could be saved especially if this had a built in alarm and was rigged to keep hallways clear of fire what an inventionwow,False,False,True
this is hilarious i want the show to have this exact feel to it,False,False,True
amazing your way of explaining is superb thank you so much,False,False,True
i was totally shocked that fusion power generation wasnt included possibly as big a leap as quantum computing in its impact on humanity,True,False,False
just because the song is called bed doesnt mean yall should sleep on it,False,True,False
being succinct is great now how long will it take for you to learn that people dont appreciate being mislead or flat out lied to do another ted talk when you figure that part out side note youve known this information for a long time this is why the most important information is buried at the bottom the media uses it to their advantage which is why in most cases the first half tends to be pointless and boring or aimed at narrative people stop paying attention so never get to the actual information,True,False,False
too mercury hahaha maybe too murky btw i think its funny when people think that et craft need a landing strip like our planes use they dont need to build speed to gain lift they can travel through the fabric of space and time i think they can manage to take off and land without a strip,False,True,False
thank you for explaining what is literature review i understand it very well,False,False,True
i would like to see this game but giving time odds or processor odds to stockfish 8 until it wins just to compare,False,True,False
an excellent and well narrated documentary not detailed enough to confuse the average person yet broader in interpretation than far too many other works a very good balance ,False,False,True
been following this project for ages and im always blown away by the attention to detail in the level design super excited to see where the game goes from here,False,False,True
dude the british kid went from an annoying kid to an absolute chad in the span of a few minutes honestly props to him for trolling with soup,True,False,False
i wish preston would go back to bed wars and skywars it was really enjoyable watching him back in the day love you walli,False,False,True
umm so i guess everyone forget that paul rudd was on friends for like 3 seasons,False,True,False
wow this movie was rawthe fact that she lied to majority of the people she spoke to about her kids because she was ashamed says volumes this was wayyyyy too good for free on youtube but im glad it was,False,False,True
nostalgia is a very personal thing that being said i dont ever see myself being nostalgic for nintendo switch sports,True,False,False
124 94 to be fair even if he had caught it he was probably coming down out of bounds,False,True,False
that auto drone scan thing should have like a 5 secs cool down at least,False,True,False
bio teachers reading the comments ,False,True,False
pragg plays a sneaky rook move aronian pushes a pawn antonio hello everyone,False,True,False
do you want a sequel leave a like subscribe full length watch alongs more for sexy rejects,False,True,False
it is awesome to explore nyterious areas,False,False,True
rich the kid amassou demais que flow ,False,True,False
ive been wanting to make this video for such a long time that royole display was just so hard to get hold of by holy cow was it worth it to check out my other ridiculous tech unboxings,True,False,False
he didnt season the burgers he burgered the seasoning,False,True,False
2021 and this song still at the top of my list the good music never dies,False,False,True
mario is pspacecomplete and factoring is in np cap bqp its a bit misleading to say that all that stands between crackers and your data is a mario level because breaking encryption is much easier than beating mario,False,True,False
all these people commenting im poor and i got a 1300 by studying a lot  we are talking about that poor people on average are less likely to get a great score not that its impossible there is a difference between inequality in general and a specific success story,True,False,False
i think hes there to learn,False,True,False
magma blocks in the bottom of water makes you sink and you should use this to make the assassin army sink then slowly die to the magma blocks and the water in magma blocks can be almost inescapable for players,True,False,False
too many rumors and with the recession coming i think its a wrong time to put stock in future guarantee apple and other big companies just dropped a big number of employees and its going to get worse if the recession is really coming,True,False,False
interesting note real wasabi is difficult to cultivate and package and ship it also grows only in a specific riverbank environment which makes real wasabi expensive and in low supply when young real wasabi is a bit sweet not spicy the wasabi that comes with your sushi dinner in america it is most often just horseradish with green food coloring this greendyed horseradish replacing actual wasabi is known in the food world as an ersatz or a replica food,False,True,False
aaaa i love you guys so much your amazing and funny i love you soooo much ,False,False,True
even just the beginning of the story has me stressed out death valley is incredibly scary and if you go off the path youre basically guaranteed to get in serious trouble,True,False,False
steve is guru of sales and marketing,False,True,False
why i disappeared,True,False,False
being a politician should not be a career choice term limits for everyone,True,False,False
these are actual adults who never grew beyond juvenile delinquency,True,False,False
if u ever feel useless in life just remember there are idiotic fools that dislike a 6 hour video of a man teaching how to use python for absolutley free,True,False,False
dont stress about it you have the pressure of scoring in the 90th percentile and not doing the worst out of all your friends your family is counting on you to get a scholarship and go to a top school its highly competitive youre competing not only with kids in your state but students in all 50 states and this is basically the test of your lifeother than the grad school exams mcatthat determines community college or top university and the difference towards getting more money towards your pay check sure dont stress about it,False,True,False
there is definitely more to this story like in june the lawyer signed a document saying that was the last of the documents as well,False,True,False
you should make a series of this for different rating tiers,False,True,False
timestamps because i know you got sheit to do 035 child 324 teen 608 college student 1155 grad student 1705 expert upvote for others to see,False,True,False
1 history stay away from me 2 history obsessed 3 history right or wrong 4 history my hero 5 history crossing the line my favourite history dramas in that order,False,True,False
sees white me you liar,True,False,False
the guy is giving a simplified summary for total beginners and people think it is an exact account if the methods they use agents have spoken with innocent and guilty people their knew how to account for simple nerves and a guilty person they know how to establish a baseline to account for individual traits and most importantly none of this can be used too convict you they cant just say yep hes the murderer he is lying and throw you in prison it is just a tool to help then when interrogating so they can have an idea if when they are being lied too or who they should focus on they still need to investigate and find actual proofv to convict you if you didnt do it they cant convict you just because you seemed like you were lying,True,False,False
bbh actually still cares for skeppy no matter how many times he trolls him thats just wholesome being friends for a decade,False,False,True
shluggishness to start the protest that could be a problem in our work environment as well lets try to be more in time for work and work with greater vigour to make this a nicer country to live in,True,False,False
when i was drafted in 1964 my starting pay was 99 per month when i got married later that year my wifes allotment of 230 per month was more than twice my base pay and when i was injured in a role as support for a certain civilian agency violating the law in southeast asia i was called a liar and threatened with a court martial i am proud of my service to my country but being in the service ducks,True,False,False
dan the man saving the day riley needs to give him his own theme like brian the electrician,False,False,True
in spite of the huge upgrades especially for the pro models it would be interesting to see how many will upgrade to the iphone 14 lineup given that the iphone 13 lineup is as popular as ever,False,False,True
i was totally shocked that fusion power generation wasnt included possibly as big a leap as quantum computing in its impact on humanity,True,False,False
happy to see chandler winning sometimes ,False,False,True
alex jones defense might actually be brilliant i didnt do it on purpose look at the lawyer he hired sent the prosecution all the evidence they needed i didnt do it on purpose he lied under oath i didnt do it on purpose i mean hes clearly guilty of torturing the victims of an elementary school shooting his choosen defense is the only option that had at least a 1 chance of working but ultimately him hiding his own money so he can declare bankruptcy defense is much stronger the old white man defense,True,False,False
the way you both missed the babys death is hilarious,False,True,False
id die of a heart attack seeing a spider like that behind my clock,True,False,False
simplilearn you are amazing thanks for teaching us a big chunk of knowledge within a couple of minutes now im much interested to become data scientist,False,False,True
this song is perfection greetings from bosnia,False,False,True
when the kid asks about the mango and you tell him to listen here son  best interaction the entire video,False,False,True
a more cynical perspective on why public statefunded education became so popular and important for industrialized countries is because their workers now required more knowledge in order to be efficient they needed to be able to read and write and have basic numeracy skills to operate machines if the cost of teaching and training people was passed on to the state then companies would not have to spend money or time giving their workforce the tools they would be expected to use worryingly the same is happening nowadays many companies complain that people leave collegeuniversity and are not prepared to enter the workforce they want someone else to teach people to be good efficient workers so that the employer can make the most of their staff from day 1,False,True,False
it still blows my mind that companies have entire teams deciding whether or not a flavor is going to appeal to the masses and yet somehow swedish fish flavored oreos were still greenlit,True,False,False
love how he gags at most of the searches but he probably searches them a 2 in the morning,False,True,False
chill ,False,True,False
congratulations bro 200k subcribers,False,False,True
i absolutely adore this series of insane biology the long videos and high quality content keep it coming,False,False,True
ps fanboys game pass is full of fodder that no one wants to play also ps fanboys cant wait for life of p,True,False,False
i got a score of 1170 when i took the practise test offered by khan academy with a 570 on maths and 600 on english in my defense it was my first attempt and i wasnt really expecting it to be this long i found your video helpfull and hope you make more sat related content,False,False,True
the crocodile was terrifying ,True,False,False
me trying in window just like him 1 st time my balance goes cube rip ,True,False,False
i was born in dhaka and have never even heard of this muslin it makes me really sad to think how much of our culture and knowledge was destroyed,True,False,False
theres something so disturbing about crystal and chuck other than neglecting evan,True,False,False
my prediction 790 math i will miss 1 question because i either miscounted squares on a graph or multiplied numbers wrong 740 reading writing i will do something stupid 1530 overall,True,False,False
the goal of evaporation is to cool down the leaf the reason leafs are green is to avoid absorbing too much radiation the sun produces a lot of energy and similar to humans a tree needs to protect himself from sunlight think about how hot it gets at solar noon and the fact that the tree needs to sit in direct sunlight for the entire day the tree is literally cooling itself down through evaporative cooling similar to how humans do it through sweating this process is known as evapotranspiration,False,True,False
yeah okay but im still learning the last thing you told me to learn right now,False,True,False
when are we as a nation going back to sincere governance elections are partisan by nature but governing is not supposed to be encumbants are tasked to address all the needs of all the citizenry the job of leadership should never be to retard the nations progress when their party doesnt hold the majority the lies and the one upmanship has got to stop the victory should be seen as the nations rather than just one party or the other it is the job of all who are serving to facilitate our progress we are so much better than what we have been doing we may have fallen short of our ideal but we should never stop striving we are guaranteed not to make it if we quit,True,False,False
firstly screening the literature is the most important aspect of a systematic review and for any other types sonot teaching students how to use ovid medline cochrane tec and only relying on pubmed is certainly the worst start up you miss such a large number of studies that whatever conclusion you try to draw will be biased and therefore unreliable,True,False,False
i love this channel,False,False,True
uh this is the opposite from what they use to say,True,False,False
chris is right he did everything so he deserves the last meal,False,False,True
my daughter will be starting her 8th grade chem section next week i told her that i used your videos to get me through my chemistry for health sciences course in college yeah i started late which was a brutal combination of gen bio and organic chem classes youre getting your next generation thanks for the help,False,False,True
now these gadgets would get rid a lot of my bruises,False,True,False
im infinitely better at controlling my anger than you bruce abused as a child loses women he loves including nat chased by the military his entire life and forced into hiding lives in fear of transforming and murdering innocents actually attempts suicide jennifer sometimes i get catcalled,True,False,False
chandler from janitor to best friend karl from camera man to best friend tereq just waiting for his time,False,True,False
1730 do you know how you remember that mycology is the study of fungi because mike is a fun guy hyuck hyuck hyuck,False,False,True
einstein would be impressed,False,False,True
quiz sequence is b weighted sum of inputs is calculated a bias is added d the result is fed to activation function c specific neuron is activated,False,True,False
i love how in the lofiverse every lofi maker doesnt compete they all chill together and promote eachother peace if only the real world was like this,False,False,True
these kid cops are out of control ,True,False,False
i got the job thank you so much,False,False,True
1246 the game is called carrom its like pool there are 9 white coins 9 black coins and 1 red coin called the queen two or four players can play the game in pair 9 white coins are with one side and 9 black coins with other whoever pockets all his coins including the red one wins the game,False,True,False
a big tip i have to give programmers is to avoid micro optimizations as a coder its generally very easy for me to sometimes fall into a pitfall of seeing a piece of my code and trying to optimize it into oblivion if you have fun then power to you coding is a hobby after all but if youre just doing it to save those precious 2ms its not worth it by any means you can do so much better stuff with your time than spending a couple hours optimizing a system for a negligible boost in efficiency,False,True,False
the reason the eu is so low has to do with the fact that countries in the eu such as italy spain portugal and cyprus since they still have large debts with the european bank can therefore not raise interest rates the countries can not repay their debt properly so that the debt becomes higher unfortunately these countries are still not doing anything in their country to ensure that their internal economies run better,True,False,False
i dont even have an idea how exactly that sat thingy works but congratulations jasmine im happy for you and im also pretty sure 5hese tips will be helpful for other tests too ,False,False,True
honestly i appreciate you and your content technical analysis is good but i find it truly baffling that major crypto youtubers just look mostly at pure ta and completely ignore the bigger narrative of why btc is pumpspumped and why the future outlook will be even rosier than it seems its kinda irresponsible to ignore the fact that each etf launch so far has caused a major dump at the peaks of btc we were already on shaky footing with historically low volume and almost pure whale pumpsnarrowly avoiding a longterm bear market more emphasis should be put into day tradiing as it is less affected by the unpredictable nature of the market i have made over 12 btc from day tradng with liberton corp insights and chartshis been one step ahead of other analysis,True,False,False
i dont know what to say about this moviejust who the hell did she think she wasmayor or assassin crazy moviethey need to lock her ass up and she wont have no more evil power over anyones life,True,False,False
this might be the time to track down all these threats and show some real consequences to the people that issue them or incite others to issue them this has to stop,True,False,False
the task of literature is to reconnect us with feelings that might otherwise be unbearable to study but which desperately need our attention so intense damn,True,False,False
im just here to say thank you to him the generosity he has shown will forever be in my heart thanks for the perfect job,False,False,True
well im sure this will end up well lol,False,False,True
if u ever feel useless in life just remember there are idiotic fools that dislike a 6 hour video of a man teaching how to use python for absolutley free,True,False,False
its also difficult to get someone to tell the truth when his salary depends on him lying,True,False,False
dans been shady and whatnot but his chemistry here with adam resulted in an awesome conversation props to both,False,False,True
remember that nintendo treehouse works with localisation and translation of games and this is what they are working on at the moment,False,True,False
love you bor ,False,False,True
i always wonder how does this man get access to their lights,True,False,False
the art for these are so good i really appreciate the effort,False,False,True
im pretty sure we all saw that coming,False,True,False
yes my fellow texans stay alert because if anything happens we are on our own abbott will likely spend 5 mins blaming the windmills then go back to his cocktail party while millions go without drinking water,True,False,False
its great video  i want 2 part please ,False,False,True
thanks luna bloom this really put me in such a relaxed trance like state ,False,False,True
ive been telling my friends this for the past couple years we are going to see fewer aaa games because games not only have to compete with other new releases but all of the preexisting games as well there is just so much competition in this industry,True,False,False
